{"capability_ids":["gen9.legality.terastallization.activation"],"chance_inputs":[],"classification_policy":{"classifier_id":"battlebelief-differential-classifier","classifier_source_digest":"sha256:c54ab4e530cb876555183dc001b26d7c78e08d08977ad12bc563b64db22ec732","classifier_version":"1","known_divergence_id":null},"corpus_id":"gen9ou-differential","corpus_version":"1","declared_comparison_fields":["effective_types","legal_actions","terastallized"],"fixture_digest":"sha256:63c5a3f50740818197a4540f1a3c154bc0d5b673a09bdf70016b1c4fcbd6e61b","fixture_id":"tera-activation","format":"gen9ou","generation":9,"initial_authoritative_full_state":{"field":{"terrain":"none","turn":1,"weather":"none"},"players":{"p1":{"active_slot":"p1a","team":[{"ability_id":"run-away","boosts":{"accuracy":0,"atk":0,"def":0,"evasion":0,"spa":0,"spd":0,"spe":0},"fainted":false,"hp":{"current":100,"maximum":100},"item_id":"none","level":100,"moves":[{"move_id":"tackle","pp":{"current":35,"maximum":35}}],"slot_id":"p1a","species_id":"eevee","stats":{"atk":55,"def":50,"hp":100,"spa":45,"spd":65,"spe":55},"status":"none","tera":{"active":false,"type":"electric"},"types":["normal"]}]},"p2":{"active_slot":"p2a","team":[{"ability_id":"torrent","boosts":{"accuracy":0,"atk":0,"def":0,"evasion":0,"spa":0,"spd":0,"spe":0},"fainted":false,"hp":{"current":100,"maximum":100},"item_id":"none","level":100,"moves":[{"move_id":"splash","pp":{"current":35,"maximum":35}}],"slot_id":"p2a","species_id":"squirtle","stats":{"atk":48,"def":65,"hp":100,"spa":50,"spd":64,"spe":43},"status":"none","tera":{"active":false,"type":"water"},"types":["water"]}]}},"terminal":{"state":"ongoing","value":null}},"joint_action_intent":[{"action":{"kind":"tera","move_id":"tackle"},"actor":"p1"},{"action":{"kind":"move","move_id":"splash"},"actor":"p2"}],"normalization":{"profile_digest":"sha256:ce1152a2ca7341a57539dcdcc90080d566b3c9bebc44276c2ba7af8edac3f505","profile_id":"canonicalization-profile","profile_version":"1"},"observation_checkpoints":[{"checkpoint_id":"after-joint-action","comparison_fields":["effective_types","legal_actions","terastallized"]}],"player_views":[{"player_id":"p1","view":{"legal_actions":[{"kind":"tera","move_id":"tackle"}],"opponent_active":{"fainted":false,"hp":{"current":100,"maximum":100},"slot_id":"p2a","species_id":"squirtle","status":"none","terastallized":false,"types":["water"]},"opponent_active_slot":"p2a","own_active":{"fainted":false,"hp":{"current":100,"maximum":100},"slot_id":"p1a","species_id":"eevee","status":"none","terastallized":false,"types":["normal"]},"own_active_slot":"p1a","tera_available":true}},{"player_id":"p2","view":{"legal_actions":[{"kind":"move","move_id":"splash"}],"opponent_active":{"fainted":false,"hp":{"current":100,"maximum":100},"slot_id":"p1a","species_id":"eevee","status":"none","terastallized":false,"types":["normal"]},"opponent_active_slot":"p1a","own_active":{"fainted":false,"hp":{"current":100,"maximum":100},"slot_id":"p2a","species_id":"squirtle","status":"none","terastallized":false,"types":["water"]},"own_active_slot":"p2a","tera_available":true}}],"provenance":{"license_id":"Apache-2.0","reviewed":true,"source_id":"task-28-synthetic-tera-activation","source_type":"project-authored"},"ruleset":{"ruleset_digest":"sha256:f11dfee276a8addfea7b292b45b6bb5d823b1728a4b446776034f84e643e7fde","ruleset_id":"synthetic-gen9ou-ruleset-v1","snapshot":{"format_id":"gen9ou","ruleset_id":"synthetic-gen9ou-ruleset-v1","ruleset_version":1}},"schema_version":1,"seed":{"seed_id":"tera-activation-seed","seed_value":"0000000000000001"}}